id;gender;masterCategory;subCategory;articleType;baseColour;season;year;usage;productDisplayName
10613;Women;Footwear;Shoes;Casual Shoes;White;Spring;2013;Casual;Carlton London Women Casual White Casual Shoes
9815;Men;Footwear;Shoes;Casual Shoes;Black;Spring;2013;Casual;Converse Men As Sketch Hi Black Casual Shoes
12520;Men;Footwear;Shoes;Casual Shoes;Black;Winter;2018;Casual;Red Tape Men Black Shoes
26527;Men;Footwear;Shoes;Casual Shoes;Red;Spring;2013;Casual;Gas Men Freetime Red Casual Shoes
31552;Men;Footwear;Shoes;Casual Shoes;Black;Winter;2016;Casual;Woodland Men Black Casual Shoes
15368;Men;Footwear;Shoes;Casual Shoes;Brown;Winter;2018;Casual;Red Tape Men Casual Brown Casual Shoes
12511;Men;Footwear;Shoes;Casual Shoes;Brown;Winter;2018;Casual;Red Tape Men Casual Brown Casual Shoes
50750;Men;Footwear;Shoes;Casual Shoes;Brown;Summer;2018;Casual;Red Chief Men Brown Shoes
26529;Men;Footwear;Shoes;Casual Shoes;Brown;Summer;2013;Casual;Gas Men Aishley Brown Casual Shoes
39595;Women;Footwear;Shoes;Casual Shoes;Blue;Winter;2015;Casual;Catwalk Women Blue Shoes
3549;Men;Footwear;Shoes;Casual Shoes;White;Winter;2015;Casual;Skechers Men's Off White Lifestyle Shoe
20814;Men;Footwear;Shoes;Casual Shoes;White;Winter;2018;Casual;Redtape Men Sporty Look White Casual Shoe
39939;Men;Footwear;Shoes;Casual Shoes;White;Spring;2013;Casual;Gas Men Venetian White Shoes
5681;Men;Footwear;Shoes;Casual Shoes;Brown;Winter;2015;Casual;Skechers Men's Compelling Dexterity Fudge Brown Shoe
17037;Men;Footwear;Shoes;Casual Shoes;Grey;Summer;2013;Casual;GAS Men Grey & Brown Caddy Sneakers
6494;Men;Footwear;Shoes;Casual Shoes;Brown;Winter;2018;Casual;Red Tape Men Brown Leather Shoe
20813;Men;Footwear;Shoes;Casual Shoes;Brown;Winter;2018;Casual;Red Tape Men Casual Brown Shoes
24649;Men;Footwear;Shoes;Casual Shoes;Black;Summer;2013;Casual;Converse Men's As Canvas Hi Black Denim Shoes
17659;Women;Footwear;Shoes;Casual Shoes;Brown;Winter;2015;Casual;Catwalk Women Ballerina Brown Casual Shoe
3585;Men;Footwear;Shoes;Casual Shoes;Black;Summer;2013;Casual;Converse Men's All Star Canvas Ox Black Shoe
5686;Men;Footwear;Shoes;Casual Shoes;Black;Winter;2015;Casual;Skechers Men Regions Black Shoe
39306;Men;Footwear;Shoes;Casual Shoes;Black;Winter;2018;Casual;Red Chief Men Black Casual Shoes
20825;Men;Footwear;Shoes;Casual Shoes;White;Winter;2018;Casual;Red Tape Men Casual White Shoes
19365;Men;Footwear;Shoes;Casual Shoes;Tan;Winter;2018;Casual;Redtape Men Calcullas Tan Casual Shoes
17039;Men;Footwear;Shoes;Casual Shoes;White;Summer;2013;Casual;Gas Men Skate 001 Casual Shoe
7321;Men;Footwear;Shoes;Casual Shoes;Brown;Winter;2018;Casual;Red Tape Men's Brown Shoe
3547;Men;Footwear;Shoes;Casual Shoes;Black;Winter;2015;Casual;Skechers Men's Lifestyle Black Shoe
4134;Men;Footwear;Shoes;Casual Shoes;Navy Blue;Winter;2015;Casual;Skechers Men's Sparta Navy Black Shoe
5688;Men;Footwear;Shoes;Casual Shoes;Brown;Winter;2015;Casual;Skechers Men Torino Dark Brown Shoe
15903;Unisex;Footwear;Shoes;Casual Shoes;White;Winter;2013;Casual;Warner Bros Kids Unisex TJ Stud Sandal White Casual Shoes
39301;Men;Footwear;Shoes;Casual Shoes;Brown;Winter;2018;Casual;Red Chief Men Brown Shoes
4133;Men;Footwear;Shoes;Casual Shoes;White;Winter;2015;Casual;Skechers Men's Sparta White Shoe
50751;Men;Footwear;Shoes;Casual Shoes;Mushroom Brown;Winter;2018;Casual;Red Chief Men Mushroom Brown Shoes
23091;Men;Footwear;Shoes;Casual Shoes;Black;Summer;2013;Casual;Converse Men Oxford Black Casual Shoes
31554;Men;Footwear;Shoes;Casual Shoes;Khaki;Summer;2016;Casual;Woodland Men Khaki Casual Shoes
32741;Men;Footwear;Shoes;Casual Shoes;Brown;Summer;2013;Casual;Fila Men Calve Brown Casual Shoes
35564;Men;Footwear;Shoes;Casual Shoes;Black;Summer;2013;Casual;Arrow Men Black Shoes
12510;Men;Footwear;Shoes;Casual Shoes;Grey;Winter;2018;Casual;Red Tape Men Casual Grey Casual Shoes
24072;Women;Footwear;Shoes;Casual Shoes;Grey;Winter;2015;Casual;Catwalk Women Grey Casual Shoes
31553;Men;Footwear;Shoes;Casual Shoes;Brown;Winter;2016;Casual;Woodland Men Brown Casual Shoes
24081;Women;Footwear;Shoes;Casual Shoes;Red;Winter;2015;Casual;Catwalk Women Red Casual Shoes
26526;Men;Footwear;Shoes;Casual Shoes;Black;Spring;2013;Casual;Gas Men Freetime Black Casual Shoes
7374;Men;Footwear;Shoes;Casual Shoes;Brown;Winter;2018;Casual;Red Tape Men's Stone Casual Shoe
39965;Men;Footwear;Shoes;Casual Shoes;Navy Blue;Spring;2013;Casual;GAS Men Navy Blue Brixton Casual Shoes
45625;Men;Footwear;Shoes;Casual Shoes;Brown;Winter;2018;Casual;Red Tape Men Brown Shoes
39991;Men;Footwear;Shoes;Casual Shoes;Brown;Summer;2013;Casual;Gas Men Romance Brown Shoes
15358;Men;Footwear;Shoes;Casual Shoes;Brown;Winter;2018;Casual;Red Tape Men Casual Brown Casual Shoes
24249;Men;Footwear;Shoes;Casual Shoes;Black;Summer;2013;Casual;Numero Uno Men Black Casual Shoes
12519;Men;Footwear;Shoes;Casual Shoes;Beige;Winter;2018;Casual;Red Tape Men Beige Shoes
39300;Men;Footwear;Shoes;Casual Shoes;Brown;Winter;2018;Casual;Red Chief Men Brown Shoes
17669;Women;Footwear;Shoes;Casual Shoes;Blue;Winter;2015;Casual;Catwalk Women Closed Blue Casual Shoe
5689;Men;Footwear;Shoes;Casual Shoes;Black;Winter;2015;Casual;Skechers Men's Liquid Roggers Black Shoe
7327;Men;Footwear;Shoes;Casual Shoes;Black;Winter;2018;Casual;Red Tape Men's Casual Black Shoe
6201;Men;Footwear;Shoes;Casual Shoes;Black;Winter;2015;Casual;Skechers Men Black Shoes
17038;Men;Footwear;Shoes;Casual Shoes;White;Summer;2013;Casual;Gas Men Draw Casual Shoe
39307;Men;Footwear;Shoes;Casual Shoes;Black;Winter;2018;Casual;Red Chief Men Black Shoes
19364;Men;Footwear;Shoes;Casual Shoes;Black;Winter;2018;Casual;Redtape Men Calcullas Black Casual Shoes
3546;Men;Footwear;Shoes;Casual Shoes;Black;Winter;2015;Casual;Skechers Men's Black Lifestyle Shoe
4135;Men;Footwear;Shoes;Casual Shoes;Black;Winter;2015;Casual;Skechers Men's Sparta Black Brown Shoe
39593;Women;Footwear;Shoes;Casual Shoes;White;Winter;2015;Casual;Catwalk Women White Shoes
57518;Men;Footwear;Shoes;Casual Shoes;Tan;Summer;2013;Smart Casual;Provogue Men Tan Brown Leather Casual Shoes
34081;Men;Footwear;Shoes;Casual Shoes;Brown;Summer;2016;Casual;Clarks Men Brown Nature Three Mahogany Leather Casual Shoes
17667;Women;Footwear;Shoes;Casual Shoes;Black;Winter;2015;Casual;Catwalk Women Buckel Black Casual Shoe
5687;Men;Footwear;Shoes;Casual Shoes;Brown;Winter;2015;Casual;Skechers Men's Traffics Brown Shoe
5673;Men;Footwear;Shoes;Casual Shoes;Black;Winter;2015;Casual;Skechers Men's Icurbantrack Solver Black Shoe
20815;Men;Footwear;Shoes;Casual Shoes;Grey;Winter;2018;Casual;Red Tape Men Casual Grey Shoes
6495;Men;Footwear;Shoes;Casual Shoes;Black;Winter;2018;Casual;Red Tape Men's Casual Black Grey Shoe
5674;Men;Footwear;Shoes;Casual Shoes;Brown;Winter;2015;Casual;Skechers Men's Icurbantrack Solver Dark Grey Shoe
39309;Men;Footwear;Shoes;Casual Shoes;Brown;Winter;2018;Casual;Red Chief Men Brown Shoes
5680;Men;Footwear;Shoes;Casual Shoes;Black;Winter;2015;Casual;Skechers Men's Compelling Desterity Black Shoe
47110;Boys;Footwear;Shoes;Casual Shoes;Blue;Spring;2013;Casual;Marvel Boys Blue & Red Spiderman Shoes
17660;Women;Footwear;Shoes;Casual Shoes;Brown;Winter;2015;Casual;Catwalk Women Ballerina Brown Casual Shoe
17036;Men;Footwear;Shoes;Casual Shoes;White;Summer;2013;Casual;Gas Men Caddy Casual Shoe
